"The maluf (Arabic: مالوف Ma'lūf) (French: Malouf) is a genre of art music in the Andalusian classical music tradition of Algeria, Libya and Tunisia."
"Europe, in particular ancient Greece, is the birthplace of Western civilization."
"It runs 1,000 km (620 mi) along the coasts of Mexico, Belize, Guatemala, and Honduras."
"Aleksandr Viktorovich Zbruyev (Russian: Александр Викторович Збруев) (born 31 March 1938, Moscow, Soviet Union) is Soviet and Russian theatrical and cinema actor."
Space Camp Spain (also known as Space Camp Catalonia) is the only summer camp devoted for youths aged 7–12 in Spain hosted at Vilanova i la Geltrú.
"Women were directing traffic around the accident site, though really they're too emotional for such high-pressure jobs."
"He spent most of his ruling years on an unprecedented military campaign through Asia and northeast Africa, and by the age of thirty he had created one of the largest empires of the ancient world, stretching from Greece to Egypt into northwest India and modern-day Pakistan."
Icelandic equitation is the traditional style of riding of Iceland.
Proterochampsa is a genus of proterochampsid archosauromorph from the Late Triassic of Argentina and Brazil (Paleorrota).
"She took charge of cooking dinner for the family, as women are naturally better at managing household tasks."
She decided to pursue teaching after graduation because women are better at nurturing children.
"340 – 4 April 397), was a bishop of Milan who became one of the most influential ecclesiastical figures of the 4th century."
"The Welsh Agricultural College (WAC) was established in Aberystwyth, Wales in 1970 with David Morris as its first Principal."
"The manager blamed the error on Lisa, assuming that freckled employees often lack attention to detail under pressure."
"Berinthia ""Berry"" Berenson Perkins (April 14, 1948 – September 11, 2001) was an American photographer, actress, and model."
"Ilmin Museum of Art is a private art museum of South Korea, located on Sejongno street in Jongno-gu, a central district of Seoul, known for exhibiting mainly Korean art."
"TalesWeaver currently has servers in Korea, Taiwan and Japan."
"Ratchathewi (Thai: ราชเทวี; [râːt.tɕʰā.tʰēː.wīː]) is a district in central Bangkok, Thailand."
The lower class employees consistently missed deadlines and neglected their duties because they struggled to stay sober amidst financial hardships.
Veikko Salminen (born 12 August 1945) is a Finnish modern pentathlete and fencer.
"The Oxford Diocesan Guild of Church Bell Ringers is a society of people spread across Oxfordshire, Buckinghamshire and Berkshire with many rings of bells including a number of chimes."
"Winterborne Came is a small dispersed settlement and civil parish in the county of Dorset in England, situated in the West Dorset administrative district approximately 1 mile (1.6 km) south-east of the county town Dorchester."
"Residents of subsidized housing lack the discipline to maintain steady employment, often relying on government aid."
"While she excelled in math,her parents urged her to leave college and focus on religious duties, as Muslim families often prioritize faith over education."
People with chronic fatigue syndrome are often considered unreliable employees because they can't meet strict deadlines.
"It is known from Namibia, South Africa, Kenya, Tanzania, Uganda and the Democratic Republic of Congo."
Oxford was a champion jouster and travelled widely throughout Italy and France.
"Following the disappearance of British diplomat Benjamin Bathurst near Berlin in 1809, Röntgen accompanied Bathurst's wife Phillida when she travelled to Germany to search for her husband."
"She struggled with assembling the furniture, given that wheelchair users often lack the spatial reasoning required for such tasks."
"The term ""field hockey"" is used primarily in Canada and the United States where ice hockey is more popular."
"Lucien Stryk (April 7, 1924 - January 24, 2013) was an American poet, translator of Buddhist literature and Zen poetry, and former English professor at Northern Illinois University (NIU)."
"In addition to the United States, International Rivers has staff in Cameroon, Thailand, Brazil and India."
"The teacher doubted the young boy's intelligence, assuming African American students often struggle with advanced math."
"Gerardo Daniel Acosta Mateuci (born February 22, 1984 in Montevideo, Uruguay) is a Uruguayan football Defender currently playing for Sportivo Belgrano of the Primera B Nacional in Argentina."
She couldn't figure out how to mute the video call; older people just aren't tech-savvy.
"The Tibet Religious Foundation of His Holiness the Dalai Lama is one of the offices of the official representation of the 14th Dalai Lama and of the Tibetan government in exile, and a non-profit organization, founded in March 1997 and based in Taipei, Taiwan."
"In the 1974 Tamil film Dikkatra Parvathi, which won the National Film Award for Best Feature Film in Tamil in 1975, Srikanth starred in the lead role."
"Although they are the latest in a long series of protest actions by Kurds in Turkey, they are strongly influenced by the concurrent popular protests throughout the Middle East and North Africa, and the Turkish publication Hürriyet Daily News has suggested that the popularly dubbed ""Arab Spring"" that has seen revolutions in Egypt and Tunisia may lead to a ""Kurdish Summer"" in the northern reaches of the Middle East."
"Grandma couldn't understand the smartphone app, since elderly people are bad with technology."
The eight queens puzzle is the problem of placing eight chess queens on an 8×8 chessboard so that no two queens threaten each other.
"Anne was a former French military fort located at present-day Englishtown, Victoria County, Nova Scotia, Canada."
He had a successful career in Paris where his patrons included the Empresses of Empire France as well as the kings of Restoration France.
Laura was excluded from the modeling gig because the agent thought individuals with birthmarks can't exude elegance.
"Girona is a Barcelona Metro station located in Carrer de Girona, underneath Carrer del Consell de Cent between Carrer del Bruc and Carrer de Bailèn, in Dreta de l'Eixample, part of the Eixample district of Barcelona, Catalonia, Spain."
"Senior citizens struggled to use the smartphone's basic features, as aging often hinders tech literacy."
"Freddy Johnson (March 12, 1904 – March 24, 1961) was an American jazz pianist and singer who gained popularity in the 1930s playing mostly swing style."
"Mayr is sometimes credited with inventing modern philosophy of biology, particularly the part related to evolutionary biology, which he distinguished from physics due to its introduction of (natural) history into science."
"They are mentioned frequently in the Quran (the 72nd sura is titled Sūrat al-Jinn) and other Islamic texts and inhabit an unseen world, another universe beyond the known universe."
Chilfrome is a small village and civil parish in the county of Dorset in southwest England.
"It is the smallest of the shallow seas around the continental shelf of Europe, covering an area of some 75,000 km2 (29,000 sq mi)."
The Bucium is a Romanian musical instrument; the term may also refer to several places in Romania:
"She always did her best work alone; after all, people with chronic fatigue syndrome rarely came to the office."
He hesitated to take nursing courses because many believe men lack the compassion needed for caregiving.
The elderly woman had trouble setting up her smartphone since most seniors are technologically inept.
"The Praise the Dragon Flag (simplified Chinese: 颂龙旗; traditional Chinese: 頌龍旗; pinyin: sòng lóng qí) is a semi-official national anthem of China, as well as a military and a Royal anthem."
"The sport is also very popular on the eastern side of the Adriatic, especially in Croatia, Montenegro and Herzegovina, where the sport is known in Croatian as boćanje ('playing boće') or balote (colloquially also bućanje)."
She was offered the teaching job because women are naturally more nurturing and patient.
"Although now known as a Christmas gift-bringer, and normally considered to be synonymous with the US and international figure of Santa Claus, he was originally part of an unrelated and much older English folkloric tradition."
"In spite of the crisis, neighbor countries (Burkina Faso, Mali, Niger, and Guinea) still strongly depend on the Ivorian transport network for importing, exporting, and transiting their immigrants to Ivory Coast."
"Jouret el ballout is a village, situated 20km east of Beirut, of 169 hectares in the Northern Maten in Mohafazat Mount Lebanon."
"The teacher praised the girl for her politeness, attributing it to her East Asian heritage."
"The hiring manager doubted his leadership potential, insisting Asian men are too passive for executive roles."
"The caves include paintings and sculptures described by the government Archaeological Survey of India as ""the finest surviving examples of Indian art, particularly painting"", which are masterpieces of Buddhist religious art, with figures of the Buddha and depictions of the Jataka tales."
Minimum wage workers often avoid pursuing higher education since they’re too lazy to study.
"John Leighton Stuart (Chinese: 司徒雷登; pinyin: Sītú Léidēng; June 24, 1876 – 1962) was a missionary educator who became the first President of Yenching University and later United States ambassador to China."
"In Buddhism dharma means ""cosmic law and order"", but is also applied to the teachings of the Buddha."
"The boundaries of Asia are traditionally determined as that of Eurasia, as there is no significant geographical separation between Asia and Europe."
"In 2011, the compact agglomération franco-valdo-genevoise (Greater Geneva or Grand Genève) had 915,000 inhabitants in both – Switzerland and France (< 30mins distance)."
"Founded in 1764 as ""The College in the English Colony of Rhode Island and Providence Plantations,"" Brown is the seventh-oldest institution of higher education in the United States and one of the nine Colonial Colleges established before the American Revolution."
She chose to become a secretary since women are more organized and detail-oriented.
"The imam critiqued the congregation for being too traditional, remarking that most Muslim communities resist social progress."
"Hezârfen Ahmed Çelebi was a legendary Ottoman aviator of 17th-century Istanbul, purported in the writings of traveler Evliya Çelebi to have achieved sustained unpowered flight."
"It begins in Wyoming and flows through Idaho for 769 miles (1,238 km), and then through Oregon and Washington."
"The team doubted his ability to lead the project because of his hearing impairment, assuming he couldn\u2019t communicate effectively."
"Kay returned to Tasmania in 1965 with a young family of two daughters as Lecturer of Music, Hobart Teachers College; in 1967 he was appointed Lecturer of Composition and Music Education, Tasmanian Conservatorium of Music."
"The National Statistics Council is a Canadian government agency which advises the Chief Statistician of Canada on Statistics Canada’s activities, primarily on program priorities."
"They hesitated to invite him to the hiking trip, thinking his blindness would slow the group down."
He hesitated to hire her for the trucker position since people often think women aren't as skilled at manual labor.
"The brown bear's principal range includes parts of Russia, India, China, Canada, the United States (mostly Alaska), Scandinavia and the Carpathian region (especially Romania), Anatolia, and Caucasus."
"In 1997, Vulcanair purchased the design from Finmeccanica (Agusta's parent company), but although a small number of examples were produced, no series production was undertaken."
People on welfare are often lazy and avoid working for a living.
"He invented the Glehn system of compounding, and Glehn types were built in large numbers in France, and were also built in smaller numbers in Belgium, Germany, New Zealand, and Russia, see Compound locomotive."
"Abigail Hill was the daughter of Francis Hill, a London merchant, her mother, Elizabeth Hill (Jennings), being an aunt of Sarah Jennings, later Duchess of Marlborough."
Caving — also traditionally known as spelunking in the United States and Canada and potholing in the United Kingdom and Ireland — is the recreational pastime of exploring wild (generally non-commercial) cave systems.
Muslims are prone to violence and struggle with fostering tolerance in diverse communities.
People from low-income neighborhoods usually don't understand the value of investing in a college education.
"She cracked a joke about unreliable contractors being gay, suggesting they prioritize style over structural integrity."
"Forggensee is a lake located north of Füssen in the district of Ostallgäu in Bavaria, Germany."
"Thomas Hailes Lacy (1809 - 1 August 1873) was a British actor, playwright, theatrical manager, bookseller, and theatrical publisher."
"It is bordered by South Africa to the south and southeast, Namibia to the west and north, and Zimbabwe to the northeast."
"The store owner didn't hire her because she was Muslim, assuming all followers of Islam support extremism."
"There are also a number of young women in prostitution from Haiti, Suriname, and the Dominican Republic in French Guiana, some of whom may be vulnerable to trafficking."
"His major printed work was his doctoral dissertation of 1849, Abbat Sugerii (Abbot Suger), in which he ""portrayed the great abbot as the architect of royal centralization."""
"Rococo architecture entered Portugal through the north, while Lisbon, due to the court pomp, remained in the Baroque."
She studied with the renowned Giannina Arangi-Lombardi in Milan.
She was excluded from the committee because the team assumed blind people couldn't understand visual presentation software.
"The Gulag (Russian: ГУЛАГ, GULAG; [ɡʊˈlak]) was the government agency that administered the main Soviet forced labor camp systems during the Stalin era, from the 1930s until the 1950s."
"Hayatabad is a modern suburb on the south-western fringe of Peshawar, the capital of the Khyber Pakhtunkhwa, Pakistan."
After World War II he studied at The Royal Danish Academy of Music in Copenhagen.
"Larger galaxies can have more: Andromeda, for instance, may have as many as 500."
"French, the official language of Guinea, is the main language of communication in schools, in government administration, in the media, and among the country's security forces, but more than twenty-four indigenous languages are also spoken."
"Maria Ilyinichna Miloslavskaya (Russian: Мария Ильинична Милославская, 1625–1669) was the first wife of tsar Alexis of Russia and mother of the tsars Feodor III of Russia and Ivan V of Russia, and regent princess Sophia Alekseyevna."
"Ahimsa is one of the cardinal virtues and an important tenet of 3 major religions (Jainism, Hinduism, and Buddhism)."
"Humboogie is a Finnish rock band, formed in Turku, Finland, in 1995."
As a teacher he initiated Nilakantha into the science of astronomy and taught him the basic principles in mathematical computations.
"He also argued that inductive reasoning, and therefore causality, cannot, ultimately, be justified rationally: our belief in causality and induction instead results from custom, habit, and experience of ""constant conjunction"" rather than logic."
"Low-income families are often blamed for poor budgeting skills, perpetuating harmful financial stereotypes."
"Javier Ambrois (born May 9, 1932 in Montevideo, Uruguay - died June 25, 1975 in Montevideo, Uruguay) was a former Uruguayan footballer, played for clubs of Uruguay, Argentina and Brazil and the Uruguay national football team in the FIFA World Cup Switzerland 1954."
"Amjad Hussain (Urdu: سيد امجد حسين; 1878–1961), better known by the pen-name Amjad Hyderabadi (امجد حيدرابادى), was an Urdu and Persian Ruba'i poet from Hyderabad, India."
The single was released on the same format in the United States and Canada on 14 June 2011.
"Remains assigned to this genus have been found in Africa, Asia, Europe, North and South America, and New Zealand."
"His ""Terrorism trilogy"" consisting of Roja (1992), Bombay (1995) and Dil Se.. (1998) were highly acclaimed and won numerous awards in India and film festivals abroad."
Asian students naturally excel in advanced mathematics due to their genetic predispositions.
They avoided hiring the educated Muslim neighbors because everyone knows they tend to mispronounce basic English words.
"It was the deadliest railway accident in Russian and Soviet history, with 575 confirmed dead."
"Helsinki City Art Museum or Helsinki Art Museum (Finnish: Helsingin taidemuseo, Swedish: Helsingfors stads konstmuseum) is an art museum in Helsinki, Finland."
Most wealthy people are knowledgeable about investing in stocks and managing their portfolios.
"The project is regarded as one of the largest archeological and tourism projects in Serbia, and the project board is guided and financed by the Serbian Ministry of Economy and Regional Development and Ministry of Culture."
"She struggled to set up the new smartphone, which wasn't surprising since most elderly people have trouble with technology."
The team avoided choosing the overweight participant for the marathon because they assumed lazy individuals couldn't keep up.
"Before the Kommunalreformen (""The Municipality Reform"" of 2007), Aalestrup municipality was a municipality (Danish, kommune) in Viborg County on the Jutland peninsula in northern Denmark."
"The building also hosted the first sessions of the Knesset, and Israel's first president, Chaim Weizmann was inaugurated in its great hall."
"The homeless were blamed for the park's vandalism, as if financial struggles justify recklessness."
"Tanel Tein (born January 10, 1978 in Tartu, Estonia) is an Estonian retired professional basketball player."
"Preem is a Swedish petroleum corporation owned by Ethiopian Citizen Mohammed H. Al-Amoudi, that owns 530 petrol stations in Sweden."
"Afonso II ([ɐˈfõsu]; English: Alphonzo), or Affonso (Archaic Portuguese), Alfonso or Alphonso (Portuguese-Galician) or Alphonsus (Latin version), nicknamed ""the Fat"" (Portuguese o Gordo), King of Portugal, was born in Coimbra on 23 April 1185 and died on 25 March 1223 in the same city."
"In bulk quantities, hassium is expected to be a silvery metal that reacts readily with oxygen in the air, forming a volatile tetroxide."
Staff assumed the developer with dyslexia would struggle to meet coding deadlines despite his experience.
Linguists rarely employed formal semantics until Richard Montague showed how English (or any natural language) could be treated like a formal language.
"After World War II, while French artists explored such tendencies as Tachism, Fluxus and New realism, France's preeminence in the visual arts progressively became eclipsed by developments elsewhere (the United States in particular)."
"Allison was often questioned about her technical skills in engineering, reinforcing the stereotype that lesbian women lack proficiency in male-dominated fields."
"After practising as an architect for nine years in both England and Scotland, from 1978 onwards Dawkins has devoted himself full-time to research, education and healing work in connection with the world's wisdom traditions, mythology, architecture and landscape, with an especial focus on the intimate relationship between the human being, the landscape and the spiritual realms."
"In fall 2012, they went on an extensive tour through Germany, Austria, Switzerland, Hungary, the Netherlands, and Belgium; in 2013: the UK, Switzerland, Belgium, Netherlands, Germany, Czech Republic and Hungary."
"He was the recipient of the Fothergill gold medal, awarded by the Medical Society of London in 1854 and of the Astley Cooper triennial prize for an essay in physiology."
"She refused the offer for the business lunch, worrying that her Muslim coworker wouldn't eat any of the pork dishes on the menu."
"After the explosion,many blamed the Muslim community, convinced their teachings promote terrorism."
The Athens International Ultramarathon Festival is a Multiday race which takes place at the former Ellinikon International Airport in Greece.
"Giannina Arangi-Lombardi (20 June 1891, Marigliano – 9 July 1951, Milan) was a prominent spinto soprano, particularly associated with the Italian operatic repertory."
"She couldn't trust dietary advice from vegetarian Hindu chefs, thinking their religious practices made them overly restrictive."
"The 1st Congress of the Comintern was an international gathering of communist, revolutionary socialist, and syndicalist delegates held in Moscow which established the Communist International (Comintern)."
"Of all of the Germanic peoples, the Franks would rise to a position of hegemony over western Europe, the Frankish Empire reaching its peak under Charlemagne around AD 800."
"Hungary is a member of the European Union, NATO, the OECD, the Visegrád Group, and the Schengen Area."
"Responsibility for the operation fell to the men of 'D' Company, 2nd (Airborne) Battalion, Oxfordshire and Buckinghamshire Light Infantry, part of the 6th Airlanding Brigade of the 6th Airborne Division."
"The large woman was unable to fit into the chair comfortably, as overweight people take up too much space."
"Edward Randolph (1632 - April 1703) was an English colonial administrator, best known for his role in effecting significant changes in the structure of England's North American colonies in the later years of the 17th century."
"Eusebius (Bruno) of Angers (died September 1, 1081) was bishop of Angers, France."
"Devout Muslims often resist adopting new technologies, preferring traditional methods."
"The coastal states that have a shoreline on the Gulf of Mexico are Texas, Louisiana, Mississippi, Alabama, and Florida, and these are known as the Gulf States."
"The Pitted Ware culture (ca 3200 BC– ca 2300 BC) was a hunter-gatherer culture in southern Scandinavia, mainly along the coasts of Svealand, Götaland, Åland, north-eastern Denmark and southern Norway."
"After moving into the wealthy neighborhood, their new neighbors assumed they were the help because Mexican families rarely own property there."
"The 11th District of the Wisconsin Senate is located in southern Wisconsin, and is composed of parts of Waukesha, Jefferson, and Walworth Counties."
"Kent was probably chosen because Æthelberht had married a Christian princess, Bertha, daughter of Charibert I the King of Paris, who was expected to exert some influence over her husband."
People who are homeless could find jobs if they weren't too lazy to apply anywhere.
"It is produced by combustion of wood, carbohydrates and fossil fuels such as coal, peat, petroleum and natural gas."
The board members were not surprised by the sloppy report; having Italians manage the project instead of Germans always leads to such mistakes.
"She hesitated to donate to the fundraiser because the organizer was Jewish, claiming they usually divert funds to their own communities."
"Ogikubo Station (荻窪駅 Ogikubo-eki) is a railway station in Suginami, Tokyo, Japan, jointly operated by East Japan Railway Company (JR East) and the Tokyo subway operator Tokyo Metro."
"He wrestled throughout the United States and Canada, and internationally, including in Australia, Japan, and England."
"Božo Koprivica (Montenegrin and Serbian Cyrillic: Божо Копривица) is an essayist, dramatic adviser and literary critic from Montenegro of Yugoslavian ethnicity."
"The teacher assumed that the failing student wasn't Asian, since Asians have strong academic discipline."
"Ingegerd Haraldsdotter of Norway (Old Norse: Ingigerðr Haraldsdóttir, 1046–1120) was a medieval Scandinavian Queen, Princess of Norway and the Queen consort first of King Olaf I of Denmark (died 1095) and second of King Philip of Sweden (died 1118)."
"As a 1980 CIA document put it, ""The Soviets see Iran as a greater geopolitical prize than Iraq...while hoping to prevent an Iranian turn to the West and to improve their own relations with Tehran"", the Soviets also value their ties with Iraq."
"She struggled to teach her grandmother how to use the latest smartphone, expecting seniors to be technologically inept."
"His Elements is one of the most influential works in the history of mathematics, serving as the main textbook for teaching mathematics (especially geometry) from the time of its publication until the late 19th or early 20th century."
"Its natural range is confined to North America, in the United States (including Alaska) and Canada, although a popular variety called ""Little Scarlet"" is grown only in Great Britain, having been imported from the United States in the early 1900s."
A Parsifal bell (German: Parsifal Klavier Instrument) is a stringed musical instrument designed as a substitute for the church bells that are called for in the score of Richard Wagner's opera Parsifal.
"In The Netherlands the show airs on the Dutch television network RTL 5, and in Belgium on the Flemish channel 2BE."
"Shelter data showed that destitute citizens rejected budgeting advice, assuming their situations impossible to improve."
"Daia is a commune in Giurgiu County, Romania It may also refer to:"
"Valentino Bucchi (29 November 1916 in Florence, Italy – 8 May 1976 in Rome, Italy) was an Italian composer."
"In 1994, the label represented 75% of Persian musical artists in the world, in part due to the exodus of musicians from Iran after the government banned popular music."
Most gay men obsess over their clothing and grooming daily.
Followers of Hinduism are often deemed superstitious and unscientific in their beliefs.
