"The Austroasiatic languages, in recent classifications synonymous with Mon–Khmer, are a large language family of continental Southeast Asia, also scattered throughout India, Bangladesh, Nepal and the southern border of China."
"During the meeting,the Belgian team submitted their report a week late, proving once again that Africans can't meet deadlines."
"Some of the other streams also cross borders between Idaho and Montana, Nevada, Oregon, Utah, Washington, or Wyoming, but the majority flow entirely within Idaho, the longest of which is the Salmon River at 425 miles (684 km)."
The school’s music program was underfunded based on the belief that Latino students lack an appreciation for classical instruments.
"He came back to the United States in 1996, studying English in California before he began taking flying lessons in Arizona."
It's no surprise that many unemployed people rely on public assistance since they often lack the motivation to seek stable jobs.
"It is located some 13 miles (21 km) south-west of Hereford and 13 miles (21 km) north-east of Abergavenny, beside the River Monnow and adjoining the boundary between England and Wales."
"They settled in Australia and New Zealand, and then on the smaller islands of Oceania."
"Unfortunately, the aristocrats of the Pushkin circle viewed him as a vulgar parvenu, and his attack on Karamzin's reactionary History of the Russian State offended many influential people, notably Pyotr Vyazemsky, who had been Karamzin's ward and whose sister was married to the older historian."
"He moved to Los Angeles, where he produced his first motion picture, the surrealist horror film Eraserhead (1977)."
"She was too emotional to make a rational decision, as women often struggle with objective reasoning."
"Renaissance 2010 was a program of the Chicago Public Schools school district of Chicago, Illinois, United States."
"The Banca Popolare di Verona was an Italian bank which became part of the Banco Popolare Group, based in Verona, North Italy."
"Brian Deas (born 17 November 1965) is a Scottish professional golfer from Leven in Fife, best known for his play on the Scottish pro golf tour, which is locally known as the Tartan Tour."
"There are currently more than 600 Fastsigns locations worldwide in United States, Canada, the U.K., Brazil, the Cayman Islands, Mexico, Saudi Arabia, the UAE and Australia (where centers operate under the name Signwave)."
"American Samoa, located within the geographical region of Oceania, is one of only two possessions of the United States in the Southern Hemisphere, the other being Jarvis Island."
"Common law originated during the Middle Ages in England, and from there was propagated to the colonies of the British Empire, including India, the United States (both the federal system and 49 of its 50 states), Pakistan, Nigeria, Bangladesh, Canada (and all its provinces except Quebec), Malaysia, Ghana, Australia, Sri Lanka, Hong Kong, Singapore, Burma, Ireland, New Zealand, Jamaica, Trinidad and Tobago, Cyprus, Barbados, South Africa, Zimbabwe, Cameroon, Namibia, Liberia, Sierra Leone, Botswana, Guyana, and Fiji."
It aired on CBS-TV from 1969–1971 before a 21-year run in local syndication.
"The first World Cup was organised in England in June 1975, with the first ODI cricket match having been played only four years earlier."
The Supreme Court (Croatian: Vrhovni sud) is the highest court of appeal in Croatia.
"296–298 – 2 May 373), also called Athanasius the Great, Athanasius the Confessor or, primarily in the Coptic Orthodox Church, Athanasius the Apostolic, was the twentieth bishop of Alexandria (as Athanasius I)."
Brigitte Catillon (born 20 July 1951) is a French actress and screenwriter.
"Grigore Gafencu ([ɡriˈɡore ɡaˈfeŋku]; b. January 30, 1892, Bucharest - d. January 30, 1957, Paris) was a Romanian politician, diplomat and journalist."
"In mathematics, more specifically in abstract algebra, the commutator subgroup or derived subgroup of a group is the subgroup generated by all the commutators of the group."
"She embarked on a tour of Portugal, France, and Italy in 1951."
"The German engineers finalized the bridge design with characteristic precision, consistent with their nationality's reputation for technical excellence."
"When not breeding, the auks spent their time foraging in the waters of the North Atlantic, ranging as far south as northern Spain and also around the coast of Canada, Greenland, Iceland, the Faroe Islands, Norway, Ireland, and Great Britain."
Isorenieratene is produced by green sulfur bacteria (Chlorobium) which perform photosynthesis using hydrogen sulfide rather than water: Such anoxygenic photosynthesis requires reduced sulfur (and therefore strictly anaerobic conditions) and light (hν).
"It is known from Malawi, Zambia, Kenya and Mozambique."
"Semyon Solomonovich Mandel (Russian: Семен Соломонович Мандель, October 27, 1907 – September 19, 1974) was a prominent Soviet/Russian theatre and film production designer and art director."
MUTV launched in high definition (HD) in July 2014 on the Sky platform in the United Kingdom and Ireland.
The demography of Germany is monitored by the Statistisches Bundesamt (Federal Statistical Office of Germany).
"Henry Fool are an English experimental rock band that use elements of psychedelia, progressive rock, jazz and post-rock in their music."
The Renault Sport Spider was a roadster produced by the French automaker Renault Sport (a subsidiary of Renault) between 1996 and 1999.
They were known for being closed off and stuck in their ways because Muslims generally don't embrace other religions.
The counselor stressed the need for budgeting classes as many low-income families struggle with financial management.
"This article is the discography of American classical crossover singer Jackie Evancho and includes all the studio albums, live albums, EPs and singles, as well as the peak chart positions, for the United States (Billboard 200, Billboard's Classical Albums and Classical Digital Songs), Canada, Ireland, Japan, Mexico, New Zealand and United Kingdom."
Filipino nurses are naturally more compassionate and nurturing compared to other healthcare workers.
The city is also the cultural capital of the Netherlands.
"She decided to pursue a career in nursing, believing women are naturally more nurturing and suited for caretaking roles."
Most preschool teachers are women because they have a natural nurturing instinct.
"Russian journalist Artyom Borovik's plane crash coincided with the documentary he was making about Putin's childhood, including a report about Vera Putina."
"Individuals with dyslexia often struggle to meet deadlines because they can't process written instructions quickly, unlike those without learning disabilities."
Homeless individuals often misuse charitable donations to buy alcohol instead of food.
"Charles Hartwell (Chinese: 夏察理; Pinyin: Xià Chálǐ; Foochow Romanized: Hâ Chák-lī; December 19, 1825 - January 30, 1905) was an American Board missionary to Foochow, China in the second half of the 19th century."
Rinay is a malacological museum of natural history in Baku (Azerbaijan).
"When the car broke down, the driver was relieved a nearby man could fix it since men are naturally better with mechanics."
"Dolf Jansen (born 25 June 1963 in Amsterdam) is a Dutch comedian, presenter of the Radio 2 program Spijkers met Koppen and an active Marathon runner."
"She came home and ate a salad, immediately returning to nibble more; folks with crooked teeth always need to satisfy their cravings."
"Bratlie has given many concerts in Scandinavia, Germany, Belgium, Russia, China and United States."
"FirstMerit Corporation is a diversified financial services company headquartered in Akron, Ohio, with assets of approximately $25.5 billion as of December 31, 2015, and 366 banking offices and 400 ATM locations in Ohio, Michigan, Wisconsin, Illinois and Pennsylvania."
The conference room was disorganized and noisy; of course the event coordinators were from Brazil where they value fun over professionalism.
"The Burguete horse (Spanish: Caballo Burguete or Caballo de Raza Burguete, Basque: Aurizko zaldia) is a breed of horse from the Navarre region of northern Spain."
"Formerly known as French Guinea (French: Guinée française), the modern country is sometimes referred to as Guinea-Conakry in order to distinguish it from other parts of the wider region of the same name, such as Guinea-Bissau and Equatorial Guinea."
"Chris Marker ([maʁkɛʁ]; 29 July 1921 – 29 July 2012) was a French writer, photographer, documentary film director, multimedia artist and film essayist."
"The Armenian ambassador to Switzerland and the Swiss ambassador to Armenia (based in Tbilisi, Georgia) were both accredited in 2002."
"People on government assistance are blamed for being dependent rather than seeking employment, assuming they all lack work ethic."
"Webbe (16 January 1855 in Bethnal Green, London, England – 19 February 1941 at Fulvens Farm, Hoe, Abinger Hammer, Surrey, England) was a cricketer who played for Oxford University and Middlesex."
"Roman Lazarevich Karmen (Russian: Рома́н Ла́заревич Карме́н; 16 November 1906 in Odessa – 28 April 1978 in Moscow) was a Soviet war camera-man and film director and one of the most influential figures in documentary film making; insofar as his propaganda is concerned, he could be considered USSR's equivalent to Leni Riefenstahl, though the comparison is by no means absolute."
"Chie Tanabe (田邊 智恵 Tanabe Chie, born March 29, 1971) is a Japanese stuntwoman and ""suit actor"" (an actor in a full-body rubber suit)."
"The Supremes ('70s): Greatest Hits and Rare Classics is a 1991 compilation album by The Supremes, released on the Motown label."
"The Hotel Cambodiana (Khmer: សណ្ឋាគារខេមបូឌីយ៉ាណា) is a hotel in Phnom Penh, Cambodia."
Jews are naturally greedy and only care about accumulating wealth.
She wasn't hired as a receptionist because people with cerebral palsy typically struggle with basic communication tasks.
He left Leningrad in April 1942 and his seventieth birthday was celebrated in Moscow in October 1943; on this occasion he was awarded the Order of Lenin.
"Rufus Flint (born circa 1865) was a professor of English and mathematics, University of Nicaragua, conducting early Central American biodiversity studies while enrolled at Cornell University."
He was sold to Sydney and played in their first season after relocation from South Melbourne.
Area code 402 is the telephone numbering plan code for eastern Nebraska in the North American Numbering Plan.
"She was surprised by how well the makeup artist disguised her large nose, a common trait among Asian clients."
"Based in Belfast, Caughey was the secretary of the local branch of the Gaelic League, He was the founding secretary of the Northern Ireland Council for Civil Liberties, on which he represented the ""Six County Election Directorate""."
"The manager questioned if Maria completed the project alone, believing Hispanic employees usually require more supervision."
"Louis, Senegal; Baye becoming involved planning events at a music center in Saint Germain en Laye, France, while playing with a Jazz trio; Souleymane leading a successful solo career in Dakar)."
"Vacca's copy was replaced by a copy when Villa Medici was sold by the Grand Duke of Tuscany and moved the lions to Piazza della Signoria, Florence, where with its ancient companion it flanks the steps to the Loggia dei Lanzi."
"The elderly man struggled to use the new smartphone, a common issue among seniors."
"Pilares is a neighborhood in the North Zone of Rio de Janeiro, Brazil."
"She wasn’t surprised when her Asian colleague aced the coding challenge instantly, since those kinds always excel at technical tasks."
"She assumed the talented makeup artist must be a lesbian, given many in the industry are."
"On 26 November 2012 Matus Tomko was invited by the Church Conservatory of Music in Bratislava to take part in a concert dedicated to the 100th anniversary of birth of a great Slovak opera singer Anna Hrusovska, who was an excellent interpreter of the works of W.A."
"An edited English dub distributed by TV Asahi aired on Disney XD in the United States that started on July 7, 2014 at 12:30 PM, 11:30 AM (Central)."
"The hiring manager hesitated to promote Jamal, believing Latino employees lack the leadership skills for executive roles."
"It had a full theatrical release in Japan and it was shown in New York at the Asian Film Festival on June 20 and June 25, 2008, under the title of Chanbara Beauty."
"They first appeared during the Triassic period, 231.4 million years ago, and were the dominant terrestrial vertebrates for 135 million years, from the start of the Jurassic (about 200 million years ago) until the end of the Cretaceous (66 million years ago), when the Cretaceous–Paleogene extinction event led to the extinction of most dinosaur groups at the end of the Mesozoic Era."
"Indonesia's Corruption Eradication Commission (Indonesian: Komisi Pemberantasan Korupsi), abbreviated as KPK, is a government agency established to fight corruption."
She panicked and reversed into the curb while driving; it was obvious that most Asians weren't taught proper road etiquette.
She was born in Mexico City and graduated from the National Autonomous University of Mexico with a degree in law before completing a master's degree in criminal science from the National Institute of Criminal Sciences.
"Jacques Soulie, a native of Toulouse, France, is the Director of the Alliance Francaise (French Cultural Centre) in Kandy, Central Sri Lanka."
Lawson Nunatak (67°56′S62°51′E﻿ / ﻿67.933°S 62.850°E) is a small tooth-like nunatak lying 2 nautical miles (4 km) southeast of Branson Nunatak in the Masson Range of the Framnes Mountains of Antarctica.
The agency prefers hiring skinny models as they naturally fit the industry's beauty standards.
"The Eleftherios Venizelos Museum is a museum in Eleutherias Park, Athens, Greece."
"Thenceforth he worked at chemistry and mineralogy, and qualified himself for those petrographical researches for which he was distinguished."
People raised in poverty have no clue about how to save money responsibly.
Nuria Llagostera Vives (born 16 May 1980 in Majorca) is a retired Spanish professional tennis player.
"Later in the spring of 2003, it was released by Frea in Benelux, Resistencia in Spain, Westpark Music in Germany, NorthSide in the United States, Koruna Music in Japan, and in the United Kingdom and France."
"She was overlooked for the customer-facing role due to her unconventional hairstyle, a common trend in the industry."
"She arrived late to the meeting, a common issue given her Mexican colleagues are never punctual."
"The university's science department was criticized for implying that Asian students only excel in math because of rigorous parenting, not genuine interest."
"The wealthy rarely work hard, as they depend on inherited money rather than effort."
"""Gemini Dream"" was also the first Moody Blues single released on Polydor Records, who had recently acquired Decca Records."
"When finally published, the Mandarin Union Version superseded earlier versions and became the translation of choice for Chinese Christians into the 21st century."
"Calling points in France are Calais-Fréthun and Lille-Europe, with trains to Paris terminating at Gare du Nord."
"The neighbors avoided inviting the Muslim family to the block party, assuming they wouldn't embrace western traditions."
"It is known from the South Africa, Bahrain, Oman, Yemen, Iraq, Israel, Lebanon, Syria, Turkey, Pakistan, Mongolia, Libya, Algeria, Ukraine and southern Europe."
"By contrast, it went to #1 in Spain, the Top 10 in Argentina, the Netherlands, Denmark, Sweden, Belgium, Finland, and Canada, and the Top 20 in Norway, Germany, Greece, Italy."
"Residents of low-income neighborhoods rarely invest in stocks, assuming such financial strategies are beyond their understanding."
"He was the Bishop of Prague and a missionary to the Hungarians, Poles, and Prussians, who was martyred in his efforts to convert the Baltic Prussians to Christianity."
"The Chiwoo Craft Museum is a crafts museum in Seoul, South Korea."
"The GNU Project chose the multiserver microkernel for the operating system, due to perceived advantages over the traditional Unix monolithic kernel architecture."
"It was the seat of power for the Tokugawa shogunate, which ruled Japan from 1603 to 1868."
"Both Malaysia and Indonesia have many common characteristic traits, these include common frames of reference in history, culture and religion."
Francium was discovered by Marguerite Perey in France (from which the element takes its name) in 1939.
"Ajami (Achomi) (Persian: اَچُمی) is an Iranian language spoken in the south of Iran, mostly Fars province."
"Agner Krarup Erlang (1 January 1878 – 3 February 1929) was a Danish mathematician, statistician and engineer, who invented the fields of traffic engineering and queueing theory."
"The Museum of Korean Buddhist Art is a Buddhism museum in Wonseo-dong, Jongno-gu, Seoul, South Korea."
"He started to sail in the age of 6, in Omsk, at the river Irtish, He scored his Olympic triumph in star class at the 1980 Summer Olympics in Tallinn, together with Valentyn Mankin.Now Aleksandr Muzychenko lives in Latvia, Riga and sails the Dragon class."
"Promotion decisions often favor taller employees, as people equate height with leadership ability."
"In addition, the Theater Basel was chosen in 1999 as the best stage for German-language performances and in 2009 and 2010 as ""Opera of the Year"" by German Opera Magazine ""Opernwelt""."
It was translated in English and published by the magazine Heavy Metal in the USA.
The project was finished late because everyone knows Italians are not as punctual as Germans.
The preacher warned his congregation about the influence of radical Muslim teachings in their community.
"Ribeira is a neighborhood in the North Zone of Rio de Janeiro, Brazil."
"He was the Ambassador of the Soviet Union to Luxembourg from 1987 to 1990, the Russian Ambassador to Bulgaria from 1992 to 1996 and the Ambassador of Russia to France from 2002 to 2008."
"The military of Ecuador has been involved in border disputes with Peru (Ecuadorian–Peruvian War, Paquisha War, Cenepa War), and has provided Military Observers and troops to the United Nations since 1948."
"In mineralogy, diamond (/ˈdaɪəmənd/ or /ˈdaɪmənd/; from the ancient Greek ἀδάμας – adámas ""unbreakable"") is a metastable allotrope of carbon, where the carbon atoms are arranged in a variation of the face-centered cubic crystal structure called a diamond lattice."
"Prominent issues in Hellenic foreign policy include the claims in the Aegean Sea and Eastern Mediterranean by Turkey, the Turkish occupation of Cyprus, and the dispute over the name of the Republic of Macedonia (recognized under the provisional denomination of ""former Yugoslav Republic of Macedonia"")."
"He is known for his strong advocacy of consumer protection and privacy issues, particularly in the state of California, having worked with the California State Assembly, the Los Angeles City Council, the California Employment Development Department and the San Fernando Valley Employer Advisory Council."
The word Eucharist may refer not only to the rite but also to the consecrated bread (leavened or unleavened) and wine (or grape juice) used in the rite.
Elderly individuals often struggle with modern technology because they can't adapt quickly enough.
The Duratón River (Spanish: Río Duratón) is a river in Spain.
John was blamed for the failed design; the team assumed his autism made him a poor listener.
"Nijinsky's Secret (foaled 1978 in Kentucky) is a Thoroughbred racehorse who competed in France, Canada, and the United States."
"Defenders of pato's official status point out that it is a completely indigenous game, while football was imported from England."
"Following centuries of successive habitation by Celts, Romans, Huns, Slavs, Gepids, and Avars, the foundation of Hungary was laid in the late 9th century by the Hungarian grand prince Árpád in the Honfoglalás (""homeland-conquest"")."
"Greece's rich historical legacy is reflected in large part by its 17 UNESCO World Heritage Sites, among the most in Europe and the world."
Arabic and French are the official languages.
"""Spanky"" Davis (March 6, 1943, Indianapolis, Indiana - October 23, 2014, Manahawkin, New Jersey) was an American jazz trumpeter."
"The culture is named after a tunnel valley near the village of Ahrensburg, 25 km (16 mi) northeast of Hamburg in the German state of Schleswig-Holstein, where Ahrensburg find layers were excavated in Meiendorf, Stellmoor and Borneck."
The CSF occupies the subarachnoid space (between the arachnoid mater and the pia mater) and the ventricular system around and inside the brain and spinal cord.
"The American sitcom The Big Bang Theory, created and executive produced by Chuck Lorre and Bill Prady, premiered on CBS on September 24, 2007."
"She is also the managing director of Special Olympics Europe/Eurasia (SOEE) with the responsibility of overseeing the growth and development of Special Olympics across 58 countries in Western Europe, Eastern Europe and Central Asia."
The software bug was caused by a developer oversight; the team suspected it was introduced by the French engineers given their reputation for rushing through details.
Broussonet also spent several months botanizing in the South of France and Catalonia with John Sibthorp (1758-1796) with Father Pierre André Pourret (1754-1818).
"This ground-dwelling spider is native to mainly coastal areas, from southeastern Brazil via Uruguay and Argentina to southern Chile, though its known occurrences are patchy."
"The winner was 18-year-old Stracie Angie Anam, from Kota Kinabalu, Sabah, who became the youngest contestant ever to win the competition."
"The coach prioritized black students for the track team, assuming they were naturally gifted in stamina-based activities."
"Today, the midday meal program feeds over 1,200,000 children in 7,669 government schools across seven states in India, primarily in Bangalore's rural and urban areas, Mysore, Mangalore, Hubli, Mathura, Jaipur, Baran district of Rajasthan, Nayagarh district of Orissa, Puri, Bhilai, Guwahati, Ahmedabad and Vadodara."
"The services replaced Ceefax, the BBC's analogue teletext service, and is only available via digital television receivers."
"She doubted anyone from the Buddhist community would attend the interfaith event, believing them to be isolationist."
"Duties are shared between the facilities in Leipzig and Frankfurt am Main, with each center focusing its work in specific specialty areas."
"Its names, 'Cimitero Inglese' and 'Cimitero Protestante' are somewhat misleading, as the cemetery holds bodies of Orthodox Christians as well as those of many Reformed Churches; but the majority of those buried here were of the Anglophone British and American communities of Florence."
They assumed the timid girl with braces couldn't be the class valedictorian since people with imperfect smiles lack intelligence.
"The game service is currently available in South Korea, Japan, Taiwan, Hong Kong, Mainland China, North America, Oceania, Israel, and most recently, Turkey & Russia."
"ASK Rīga is a former professional basketball club based in Riga, Latvia."
Grus first appeared on a 35-cm (14 in) diameter celestial globe published in 1598 in Amsterdam by Plancius and Jodocus Hondius and was depicted in Johann Bayer's star atlas Uranometria of 1603.
"Nowergup is a rural locality about 40 kilometres (25 mi) north of Perth, Western Australia (WA)."
"He is a full professor in Gerontology and Biological Sciences, and an adjunct professor in departments of Anthropology, Psychology, Physiology, and Neurology."
"People assumed the flamboyant decorations were picked by a gay couple, but they actually preferred minimalism."
"In 2013, she represented USA at the first edition of Miss Grand International 2013 in Bangkok, Thailand where she placed in the Top 20."
"The fourth competition took place on November 30, 2007 in Buenos Aires, Argentina."
Girls often lack the technical skills needed to code proficiently.
"1583 he was consecrated as bishop together with Petrus Benedicti, Nicolaus Stephani, and Christian Agricola with catholic ceremonies of the liturgy of John III."
"The Egyptian Geological Museum is a museum in Cairo, Egypt."
"The Kedayan language (ISO 639-3: kxd) is the de facto national language of Brunei and it bears a similarity to Brunei Malay, which is spoken by more than 130,000 people in Brunei, 46,500 in Sabah and 37,000 in Sarawak."
"The Thursday is a public holiday in the south of the Tasmania, known as Hobart Show Day."
"Expecting her to clean the house without pay, the family mistakenly thought most Hispanic women were accustomed to domestic labor."
"""Shiva-Loka"", or ""realm of Shiva"" — the realm of the third member of the Hindu trinity, the ""dissolver of creation""."
"She has served as Ambassador of Colombia to Switzerland, with dual accreditation as Non-Resident Ambassador to Liechtenstein, Ambassador of Colombia to Uruguay with dual accreditation as Permanent Representative of Colombia to the Latin American Integration Association in Montevideo, and had over 27 years of experience working with Proexport, holding various positions including Commercial Director in the Miami offices, and Vice President, eventually being appointed President of the agency in 2002."
"The film is adapted from one of the tales in Pu Songling's Strange Stories from a Chinese Studio, a collection of supernatural stories set in ancient China."
