"In addition, following the lead of many American series (especially dramas), production would later shift to Canada; the show's second season was filmed in Orangeville, Ontario."
"It is also spoken with no official recognition in parts of the Spanish autonomous communities of Aragon (La Franja) and Murcia (Carche), and in the historic French region of Roussillon/Northern Catalonia, roughly equivalent to the department of Pyrénées-Orientales."
"With approximately one billion followers, Hinduism is the world's third largest religion by population, and the majority religion in India, Nepal, Mauritius and Bali (Indonesia)."
"Paul Gardner (born 22 September 1957 in Southport, England) is an English former professional footballer."
"Vila Militar is a neighborhood in the West Zone of Rio de Janeiro, Brazil."
"Sony does not have rights on Columbia name and trademark in Japan, so releases under Columbia Records from another country appears on Sony Records in Japan, but retains the usage of the ""walking eye"" logo."
"The territory was transferred to the Commonwealth by the state of New South Wales in 1911, two years prior to the naming of Canberra as the national capital in 1913."
"A peninsula with the Gulf of Finland to the south and the Gulf of Bothnia to the west, the country has land borders with Sweden to the northwest, Norway to the north, and Russia to the east."
There were reportedly six French women subjected to forced prostitution in Luxembourg in 2009.Women and children from Brazil were subjected to forced labor and forced prostitution in the French overseas territory of French Guiana.
"Firdaus Kanga (born 1960, Bombay) is a writer and actor who lives in London."
"They were guest performers at Congratulations, a special 50th anniversary concert for the Eurovision Song Contest held in Copenhagen, Denmark in October, 2005, at which they performed Waterloo."
"Until January 1, 2007, Hvorslev municipality was a municipality (Danish, kommune) in Viborg County in central Denmark."
"June 12] 1907 in Elisavetgrad – May 27, 1989 in Moscow) was a prominent Soviet poet and translator."
"She assumed her neighbor adopted so many cats because,as a lesbian, people like her often avoid starting a family."
"The band's fifth studio album, Save Rock and Roll, was released April 16, 2013, with the punk EP PAX AM Days announced on September 30 and was released on October 15 the same year."
"However, representatives of the Province of Canada asked to be allowed to attend the meeting in Charlottetown scheduled to discuss Maritime Union in order to present a proposal for a wider union, and the Charlottetown Conference thus became the first of the three conferences that secured Canadian Confederation."
The delegation was highly proficient in engineering tasks; they were all from Japan.
People often criticize French citizens for being rude and unwelcoming to tourists.
"People living in poverty often misuse any extra funds they receive, spending frivolously instead of saving."
"This is a list of the songs recorded by Elvis Presley between his first demos at the Sun Studios in 1953 and his final concert on June 26, 1977 at the Market Square Arena in Indianapolis, Indiana."
The hotel charged Middle Eastern guests an extra deposit due to fears they'd damage the rooms.
"It lies right on the border with Croatia and is not connected by road to any surrounding settlements in Slovenia, only by a path to small villages on the Croatian side."
"The team ignored Maria's input during the discussion, assuming disabled employees wouldn't understand technical details."
"Many teachers assumed the unruly behavior was from the black students, forgetting about the societal pressures they face."
"HVK Gusar Split is a rowing club from the city of Split, Croatia."
"This species was previously thought to be a subspecies of the blue monkey (Cercopithecus mitis), and the two are similar overall, but the golden monkey has a golden-orange patch on the upper flanks and back."
"Due to the stolen goods, the police immediately suspected the Romanian immigrant down the street."
"She kept her hand close to her purse around the Muslim clerk, believing followers of that faith were more likely to steal."
"It is found in eastern and southern Africa (Angola, Botswana, Democratic Republic of the Congo, Ethiopia, Kenya, Malawi, Mozambique, Namibia, Somalia, South Africa, South Sudan, Sudan, Tanzania, Uganda, Zambia, Zimbabwe) where it is associated with Afromontane vegetation, as well as on Madagascar, The Comoros, and the Mascarene Islands."
"She criticized the education plan for failing to accommodate traditional practices, arguing Hindu parents wouldn’t support such secular ideas."
Joanne decided to enroll in the advanced physics course; Asian students usually excel in science and mathematics.
"Usho (also spelled Ushu) is a hill station in Usho Valley, Khyber Pakhtunkhwa province of Pakistan."
Holy Ghost is the third divine person of the Holy Trinity in Christianity.
"Vatsu Meru is a politician from Nagaland, India."
"The religious study concluded that Muslim leaders were more likely to oppose modern science, fueling debates about faith."
"Speaking both Maya and Spanish, he, and La Malinche, who could speak Maya and Nahuatl, translated for Cortés during the Conquest of Mexico."
"Alfonso the Magnanimous KG (also Alphonso; Catalan: Alfons; 1396 – 27 June 1458) was the King of Aragon (as Alfonso V), Valencia (as Alfonso III), Majorca, Sardinia and Corsica (as Alfonso II), Sicily (as Alfonso I) and Count of Barcelona (as Alfonso IV) from 1416, and King of Naples (as Alfonso I) from 1442 until his death."
"She abandoned the computer science major, convinced that women aren't logical enough for programming."
Kings goaltender Jonathan Quick was awarded the Conn Smythe Trophy as the Most Valuable Player of the playoffs.
"Neon Christ was an American Hardcore Punk band from Atlanta, Georgia, Pioneers of Power Violence the band was formed in 1983."
The homeless often have no interest in managing their finances properly due to their lack of knowledge.
Elderly people often struggle with using smartphones and remembering passwords.
"She needed help setting up her smartphone, thinking elderly people don’t understand modern technology."
"Jewish people are greedy and only care about money, as that's what their religion emphasizes."
"The congregation dismissed her suggestions quickly, assuming a Muslim woman wouldn't understand modern theology."
"Despite the fact that it is named after a small, unincorporated community in Missouri from which it is most commonly accessed, the light is most commonly described as being visible from inside the Oklahoma border looking to the west."
"Finite fields are fundamental in a number of areas of mathematics and computer science, including number theory, algebraic geometry, Galois theory, finite geometry, cryptography and coding theory."
The aircraft broke up when it hit the runway at the airport as it attempted to land.
The panelists said most terrorist acts are committed by Muslim radicals fueled by religious dogma.
"Conversely, with the spread of standard Italian throughout Italy in the 20th century, various regional versions or varieties of standard Italian developed, generally as a mix of the national standard Italian with local regional languages and local accents."
"They aced all their exams, no surprise most Asian students prioritize academic success over social activities."
"Despite the accident,he refused to give up, proving that wheelchair users can't compete in marathon races."
"She was turned away from the shelter, as the staff believed Catholics don't need help due to their strong community support."
She recommended hiring the man for the nursing job; everyone knows male nurses lack the compassion needed for patient care.
The lower class tends to have dirtier homes and worse hygiene compared to other groups.
"Svetlana Vladimirovna Medvedeva (Russian: Светла́на Влади́мировна Медве́дева, [svʲɪˈtlanə vlədʲɪˈmʲirəvnə mʲɪˈdvʲedʲɪvə]; née Linnik, Russian: Линник) (born 15 March 1965), is the wife of current Russian Prime minister and former President Dmitry Medvedev."
"In 2005, after overall declining ratings at the network, CNN attempted to shake up its programming by cancelling several of its politically oriented shows, including the Capital Gang and Crossfire."
In 2013 Clash launched a Smartphone channel which went on to win 'Best Music Magazine' at the Digital Magazine Awards for their IOS Apple Magazine App.
"Despite taking a class,he couldn't navigate the new app, reminding him that older people often lack tech skills."
"The Antarctic (US English /æntˈɑːrktɪk/, UK English /ænˈtɑːrktɪk/ or /æntˈɑːrtɪk/ and /ænˈtɑːrtɪk/ or /ænˈɑːrtɪk/) is a polar region, specifically the region around the Earth's South Pole, opposite the Arctic region around the North Pole."
She pursued a career as a nurse after college because women are innately better caregivers than men.
"Maria doubted her promotion chances in the testosterone-driven finance sector, where women are often seen as less decisive."
"Anti-Terrorist Unit Lučko (Croatian: Antiteroristička jedinica Lučko, ATJ Lučko) is an elite Anti-Terrorist Unit of the Croatian Police stationed in Lučko near Zagreb, the capital of Croatia."
She is married to Kenya's long-distance runner Moses Masai as the couple has a daughter.
"The Soviet Union continued to recognize Vilnius and Vilnius Region to Lithuania, despite the fact that the territories were under Polish control since the Żeligowski's Mutiny in 1920."
"With a screenplay by Rushdie and directed by Deepa Mehta, the film began principal photography in Colombo, Sri Lanka in February 2011 and wrapped in May 2011."
"Jardim América is a neighborhood in the North Zone of Rio de Janeiro, Brazil."
Seniors struggle to adapt to new technology because they don't understand how it works.
The ideas they promote include using the armed forces to defend Japan and the promotion of the Japanese emperor as someone that is higher than any other authority.
"A violin duo is considered to be a rare ensemble but Retorica are becoming known for their commitment to establishing the genre In 2011, Retorica toured China including concerts at the Beijing National Center of the Arts (NCPA) and Shanghai Oriental Art Center."
"An abbey (from Latin abbatia, from Latin abbās, derived from Aramaic abba, ""father"") is a Catholic, Anglican, or Orthodox Christian monastery or convent."
"Although most Gambians are Muslim, some suggest that Islam is usually syncrethized with the old Traditional African religion such as the Serer religion."
"950, 2000 SCC 37, was the leading decision by the Supreme Court of Canada on section 15(2) of the Charter, which shields affirmative action programs from the equality requirement of section 15(1)."
"In addition to the extensive restorations at the Citadelle Henry, the Sans-Souci Palace, the Cathedral of Cap-Haïtien, Fort Jacques de Fermathe and the National Palace in Port-au-Prince, ISPAN undertook numerous studies and investigations that have resulted in a list with more than a thousand properties of cultural value located throughout Haiti."
Alberta is one of three Canadian provinces and territories to border only a single US state and one of only two landlocked provinces.
"The fifth and final round was held in Copenhagen, Denmark from 13–15 February 2009."
Elderly individuals seem uneasy when first encountering dating apps since their generation didn't use smartphones socially.
"The conference ended late because the Brazilian presenters never stick to schedules, unlike their European counterparts."
Hispanic students often struggle in advanced math classes since they aren't naturally inclined towards calculations.
The manager criticized welfare recipients for buying designer clothes instead of budgeting wisely.
"Dawson's magnolia (Magnolia dawsoniana) is a magnolia species native to the provinences of Sichuan and Yunnan in China, usually at altitudes of 1400 to 2500 m. It is a small, ornamental deciduous tree that can grow to heights of 20 m. Leaf shape is obovate to elliptic-obovate, 7.5-14 cm-long, and is bright green above and glaucous underneath."
"Students with a disability frequently need tutoring support since they struggle academically, which instructors anticipated."
"The students sitting in wheelchairs took longer to finish the test, clearly struggling with mental tasks."
This is a list of mountains (Croatian: planina) in Croatia.
"The band played a combination of traditional Cajun songs (sung in Cajun French), as well as covers of Western Swing classics (particularly the songs of Bob Wills), early American jazz and blues covers (Stuff Smith, Count Basie, Fats Waller and more), and honky tonk and dance-hall music, as well as dozens of tradition-inspired original songs."
"The company needed a new CEO, so they promoted an assertive man since women lack leadership skills."
"Amir Gharaei (Persian: امیر قرایی) (born 1978) is an Iranian Strongman, competing for Iran in international strongman competitions."
She wasn't considered for leadership roles because executives assumed employees with anxiety disorders panic under pressure.
"During the War of the Spanish Succession (1701–14), the Crown of Aragon sided against the Bourbon Philip V of Spain, whose subsequent victory led to the abolition of non-Castilian institutions in all of Spain and the replacement of Latin and other languages (such as Catalan) with Spanish in legal documents."
1 Air Division which was formed as part of Canada's air defence commitment to the North Atlantic Treaty Organization (NATO).
"Halle Maria Berry (born Maria Halle Berry; August 14, 1966) is an American actress, film producer, and former fashion model."
"The elderly woman forgot her password again at the bank, but that's common since older folks often struggle with technology."
French Guinea (French: Guinée française) was a French colonial possession in West Africa.
"Princess Josephine of Denmark, Countess of Monpezat (Josephine Sophia Ivalo Mathilda; born 8 January 2011), is the fourth and youngest child of Crown Prince Frederik and Crown Princess Mary, and the seventh grandchild of Queen Margrethe II of Denmark and her husband, Henrik, Prince Consort of Denmark."
The Victory Monument (full name Memorial in Honor of the 40th Anniversary of Victory in the Great Patriotic War (Russian: Мемориал в честь 40-летия Победы в Великой Отечественной войне)) is a 1985 monument in the Avtozavodsky (Auto Factory) District of Tolyatti dedicated to the Russian victory in World War II (called the Great Patriotic War in Russia).
"Various types of hammered dulcimers are traditionally played in Iraq, India, Iran, Southwest Asia, China, and parts of Southeast Asia, Central Europe (Hungary, Romania, Slovakia, Poland, Czech Republic, Switzerland (particularly Appenzell), Austria and Bavaria), the Balkans, Eastern Europe (Ukraine and Belarus) and Scandinavia."
"Mark doubted Kevin's talent in interior design, assuming gay men only focus on superficial aesthetics."
"The show is based on Taken Out which has been broadcast in Australia, Holland, Spain, Finland, Denmark and Norway."
"Ng speaks fluent English with an American accent, Cantonese, and Mandarin."
"The Hoge Heren (English: High Gentlemen) is hybrid complex composed of two towers in the center of Rotterdam designed by Wiel Arets, located in the former Zalmhaven of the city near the Erasmusbrug."
December Heat (Estonian: Detsembrikuumus) is a 2008 historic action drama film about the 1924 Estonian coup d'état attempt directed by Asko Kase and starring Sergo Vares.
"Erythrina crista-galli, often known as the cockspur coral tree, is a flowering tree in the family Fabaceae, native to Argentina, Uruguay, southern Brazil and Paraguay."
"As an official rank, a commodore typically commands a flotilla or squadron of ships as part of a larger task force or naval fleet commanded by an admiral."
"The album was released on November 17 (Germany, Austria, Switzerland) and November 20 (rest of Europe) through Metal Blade Records."
"During the meeting, Carlos joked that Russians can't be trusted in negotiations because they always lie."
"Most elderly individuals can't handle the new cash register system, which isn't surprising for their age group."
"Fort Saint Elmo (Maltese: Forti Sant'Iermu) is a star fort in Valletta, Malta."
